{
  "antenna_id": "90144",
  "address": "ΥΠΕΡΑΝΩ ΟΙΚΙΣΜΟΥ ΣΜΕΡΝΑΣ, ΟΡΟΣ ΛΑΠΙΘΑΣ",
  "position_code": 3004150,
  "municipality": "Ανδρίτσαινας - Κρεστένων",
  "code_name": "ΛΑΠΙΘΑΣ",
  "region": "Δυτικής Ελλάδας",
  "latitude": 37.554167,
  "company": "ΠΑΝΑΓΙΩΤΗΣ ΚΟΤΣΟΠΟΥΛΟΣ (101,3 KISS FM)",
  "longitude": 21.678611,
  "permit_status": "Από τα στοιχεία που τηρούνται στην Ενημερωτική Πύλη προκύπτει ότι, για τη θέση \"ΥΠΕΡΑΝΩ ΟΙΚΙΣΜΟΥ ΣΜΕΡΝΑΣ, ΟΡΟΣ ΛΑΠΙΘΑΣ\" στον Δήμο Ανδρίτσαινας - Κρεστένων Περιφέρειας  Δυτικής Ελλάδας \n\t(κωδικός αριθμός θέσης 3004150, κωδική ονομασία \"ΛΑΠΙΘΑΣ\") χορηγήθηκε, με την Απόφαση της ΕΕΤΤ \n7895/Φ610/08-05-2012, άδεια κατασκευής κεραίας στην εταιρία ΠΑΝΑΓΙΩΤΗΣ ΚΟΤΣΟΠΟΥΛΟΣ (101,3 KISS FM). \nΑπό τo έγγραφο της άδειας μπορείτε να ενημερωθείτε για τις σχετικές εγκρίσεις των συναρμόδιων φορέων, καθώς και εάν πρόκειται για τροποποίηση παλαιότερης άδειας.\nΗ άδεια χορηγήθηκε, κατόπιν της με Αριθ. Πρωτ. 15971/25-04-2012 αίτησης, \n\tμε τη διαδικασία αδειοδότησης της παρ. 17 του άρθρου 30 του Ν.4070/2012 που πλέον έχει αντικατασταθεί από τη διαδικασία που ορίζει ο ν. 4635/2019.",
  "measurements_eaee": "-",
  "documents": [
    {
      "document_number": "87978/07-08-2013",
      "protocol_number": "7895/Φ610/08-05-2012",
      "type": "Άδεια Κατασκευής  Κεραίας",
      "file_url": "https://silia.eett.gr/silia/download/e5ac7c84-4739-4756-a3a4-580ccb23641c"
    }
  ]
}